### ISSUE TITLE
do I need copy on_writev buffer ?

### ISSUE THREAD

**Issue by calvin2021y** [pyos/libcno#7]
when on_writev called from a event loop app,  should I copy cno_buffer_t array ?  

so should I just keep pointer and free it when the write is finished ?

```sh
 NOTE: calls to `on_writev` must be atomic w.r.t.  each other so that frames don't mix.
```

This mean I can use uv_write to send buffer at once?

**Comment by pyos** [comment]
If you're using a callback-based library, then yes, you should copy the array (deep-copy, i.e. including the contents of the elements) and retain the copy until the callback is called. Might be more efficient to just concatenate into a single string though. In "stackful coroutines" style libraries where async calls switch the stack this is not necessary.

>This mean I can use uv_write to send buffer at once?

Yes, looks like it.

**Comment by pyos** [comment]
I should probably note that I'm not actively maintaining this library. Since you're using libuv, you could try [libh2o](https://h2o.examp1e.net/faq.html), though it seems a bit lacking in documentation. There's also [nghttp2](https://nghttp2.org/), but from a cursory glance it only appears to support libev.

**Comment by calvin2021y** [comment]
Thanks for the quick reply.  I like the design and small code size. 

I will check libh2o late, I hope it support build without openssl.

One more question about on_message_head/on_message_push/on_message_data:  it will be free when callback finished ?

**Comment by pyos** [comment]
Yes, pointers passed to callbacks are only guaranteed to be live until the callback returns.

**Comment by calvin2021y** [comment]
Do I need keep memory from cno_write_head/cno_write_frame/cno_write_data ? 

I send data to client in on_frame_send callback:

by first call cno_write_head, then `cno_write_frame `( or cno_write_data, try both).  

I can seed on_writev only call once, and wireshark only catch the head response without data payload. (I can seed on_message_tail fired after I quit cno_write_frame)


Any idea what cause the body payload not send ?

**Comment by calvin2021y** [comment]
Sorry, I can seed cno_write_data do send the data.

**Comment by calvin2021y** [comment]
I am try setup a simple grpc server here.
I can seed from go grpc server response 3 type data:

```sh
Frame 18: 138 bytes on wire (1104 bits), 138 bytes captured (1104 bits) on interface en0, id 0
Ethernet II, Src: RealtekU_12:34:56 (52:54:00:12:34:56), Dst: c2:02:64:bc:9a:0e (c2:02:64:bc:9a:0e)
Internet Protocol Version 4, Src: 10.0.0.13, Dst: 10.0.0.1
Transmission Control Protocol, Src Port: 50054, Dst Port: 52674, Seq: 55, Ack: 152, Len: 72
HyperText Transfer Protocol 2
    Stream: HEADERS, Stream ID: 1, Length 14, 200 OK
        Length: 14
        Type: HEADERS (1)
        Flags: 0x04, End Headers
            00.0 ..0. = Unused: 0x00
            ..0. .... = Priority: False
            .... 0... = Padded: False
            .... .1.. = End Headers: True
            .... ...0 = End Stream: False
        0... .... .... .... .... .... .... .... = Reserved: 0x0
        .000 0000 0000 0000 0000 0000 0000 0001 = Stream Identifier: 1
        [Pad Length: 0]
        Header Block Fragment: 885f8b1d75d0620d263d4c4d6564
        [Header Length: 54]
        [Header Count: 2]
        Header: :status: 200 OK
            Name Length: 7
            Name: :status
            Value Length: 3
            Value: 200
            :status: 200
            [Unescaped: 200]
            Representation: Indexed Header Field
            Index: 8
        Header: content-type: application/grpc
            Name Length: 12
            Name: content-type
            Value Length: 16
            Value: application/grpc
            content-type: application/grpc
            [Unescaped: application/grpc]
            Representation: Literal Header Field with Incremental Indexing - Indexed Name
            Index: 31
    Stream: DATA, Stream ID: 1, Length 7
        Length: 7
        Type: DATA (0)
        Flags: 0x00
        0... .... .... .... .... .... .... .... = Reserved: 0x0
        .000 0000 0000 0000 0000 0000 0000 0001 = Stream Identifier: 1
        [Pad Length: 0]
        DATA payload (7 bytes)
    Stream: HEADERS, Stream ID: 1, Length 24
        Length: 24
        Type: HEADERS (1)
        Flags: 0x05, End Headers, End Stream
        0... .... .... .... .... .... .... .... = Reserved: 0x0
        .000 0000 0000 0000 0000 0000 0000 0001 = Stream Identifier: 1
        [Pad Length: 0]
        Header Block Fragment: 40889acac8b21234da8f013040899acac8b5254207317f00
        [Header Length: 40]
        [Header Count: 2]
        Header: grpc-status: 0
            Name Length: 11
            Name: grpc-status
            Value Length: 1
            Value: 0
            [Unescaped: 0]
            Representation: Literal Header Field with Incremental Indexing - New Name
        Header: grpc-message: 
            Name Length: 12
            Name: grpc-message
            Value Length: 0
            Value: 
            [Unescaped: ]
            Representation: Literal Header Field with Incremental Indexing - New Name
GRPC Message: /demo.Demo/Add, Response
Protocol Buffers: /demo.Demo/Add,response
```

On my `on_frame_send` callback, I call 3 function in order:

step 1: cno_write_head  like  ` Stream: HEADERS, Stream ID: 1, Length 14, 200 OK`

step 1: cno_write_data  like  ` Stream: DATA, Stream ID: 1, Length 7`

step3: cno_write_head  like  ` Stream: HEADERS, Stream ID: 1, Length 24`

But the step3 is not cause any data send out.

If I use cno_write_frame in step 2, also nothings send out.

**Comment by calvin2021y** [comment]
I find there is cno_error: `1, already sent headers on this stream`

**Comment by calvin2021y** [comment]
I use cno_write_head/ cno_write_data / cno_write_tail from on_message_data callback, it work.
